### ISSUE TITLE
RAW IP_packet

### ISSUE THREAD

**Issue by ArtWachowski** [nfstream/nfstream#21]
Hi, 

To break the ice ... Amazing project, I only started to play with NFstream two days ago and already love it! My supervisor got this amazing idea "Hey, why don't you introduce ML to your project" I was crying from happiness ... anyways I have few 'questions' 

1) 
I need to go deep, like really deep into the packet, so I started to investigate available options like  ip_packet . print and I am getting some errors, not  really sure if this is me or some bug  

    def on_update(self, pkt, flow): # flow update with each packet belonging to the flow
        if pkt.dst_port == 102:
            print('PRINT PKT',  pkt) 
        pass

 PRINT PKT NFPacket(time=1595197357768, raw_size=128, ip_size=114, transport_size=74, payload_size=74, nfhash=(6, 0, '192.168.62.132', '192.168.62.141', 102, 49875), src_ip='192.168.62.132', dst_ip='192.168.62.141', src_port=49875, dst_port=102, protocol=6, vlan_id=0, version=4, tcpflags=tcpflags(syn=0, cwr=0, ece=0, urg=0, ack=1, psh=1, rst=0, fin=0), ip_packet=b'E\x00\x00rPG@\x00\x80\x06\xab\xdc\xc0\xa8>\x84\xc0\xa8>\x8d\xc2\xd3\x00fwVH\xa1v\xc9\xb2kP\x18 \x11\x97\xc3\x00\x00\x03\x00\x00J\x02\xf0\x80\x01\x00\x01\x00a=0;\x02\x01\x03\xa06\xa04\x02\x01\x1a\xa4/\x80\x01\x01\xa1*\xa0(0&\xa0$\xa1"\x1a\x12simensSIMENS_RC7_A\x1a\x0cGGIO1$CF$Mod', root_idx=19, direction=1, closed=True)
PRINT PKT NFPacket(time=1595197357823, raw_size=60, ip_size=40, transport_size=0, payload_size=0, nfhash=(6, 0, '192.168.62.132', '192.168.62.141', 102, 49875), src_ip='192.168.62.132', dst_ip='192.168.62.141', src_port=49875, dst_port=102, protocol=6, vlan_id=0, version=4, tcpflags=tcpflags(syn=0, cwr=0, ece=0, urg=0, ack=1, psh=0, rst=0, fin=0), ip_packet=b'E\x00\x00(PH@\x00\x80\x06\xac%\xc0\xa8>\x84\xc0\xa8>\x8d\xc2\xd3\x00fwVH\xebv\xc9\xb2\x8dP\x10 \x11\xe4\x8e\x00\x00\x00\x00\x00\x00\x00\x00', root_idx=19, direction=1, closed=True)

    def on_update(self, pkt, flow): # flow update with each packet belonging to the flow
        if pkt.dst_port == 102:
            print(pkt.ip_packet)
        pass
b'E\x00\x00rQ\xf4@\x00\x80\x06\xaa/\xc0\xa8>\x84\xc0\xa8>\x8d\xc2\xd3\x00fwVI\xc9v\xc9\xb2\xf3P\x18 \x10\x92\x14\x00\x00\x03\x00\x00J\x02\xf0\x80\x01\x00\x01\x00a=0;\x02\x01\x03\xa06\xa04\x02\x01\x1e\xa4/\x80\x01\x01\xa1*\xa0(0&\xa0$\xa1"\x1a\x12simensSIMENS_RC7_A\x1a\x0cGGIO1$CF$Mod'
b'E\x00\x00(Q\xf5@\x00\x80\x06\xaax\xc0\xa8>\x84\xc0\xa8>\x8d\xc2\xd3\x00fwVJ\x13v\xc9\xb3\x15P\x10 \x10\xe2\xdf\x00\x00\x00\x00\x00\x00\x00\x00'

This is what scapy does, its seems to be right":  (Exactly same packet type) * (IEC61851 MMS with ANS.1 and BER) 
[Info] Found the following (IP layer): 192.168.62.132 -> 192.168.62.141
b'\x03\x00\x00J\x02\xf0\x80\x01\x00\x01\x00a=0;\x02\x01\x03\xa06\xa04\x02\x01\x1b\xa4/\x80\x01\x01\xa1*\xa0(0&\xa0$\xa1"\x1a\x12simensSIMENS_RC7_A\x1a\x0cGGIO1$CF$Mod'

[Info] Found the following (IP layer): 192.168.62.141 -> 192.168.62.132
b'\x03\x00\x00"\x02\xf0\x80\x01\x00\x01\x00a\x150\x13\x02\x01\x03\xa0\x0e\xa1\x0c\x02\x01\x1b\xa4\x07\xa1\x05\xa2\x03\x85\x01\x00'

And this is what I should see:

![image](https://user-images.githubusercontent.com/47650079/87887369-6fb13180-ca1c-11ea-936e-976b395c0e0a.png)

2) It would be amazing to have an option to get_full_ packet same way as ip_packet gets payload  ... for 'plugin' processing and stuff 

3) do you guys have any additional resources, docs for ML side of things, loading models etc 

Regards,

A,W

**Comment by ArtWachowski** [comment]
... TCPDump is correct ... I mean receives whats send from controller... I think solution to my problem is elsewhere, maybe something to do with actual sockets, just thinking out loud here    

Traces for ref,  " keepalives are with  x00\x00\x00\x00\x00\x00\x00' "

NFstream 
00:57:59.099446 IP (tos 0x0, ttl 128, id 28013, offset 0, flags [DF], proto TCP (6), length 40)
    192.168.62.132.49741 > 192.168.62.141.102: Flags [.], cksum 0x7433 (correct), seq 2156574138, ack 3686877298, win 8210, length 0
        0x0000:  4500 0028 6d6d 4000 8006 8f00 c0a8 3e84  E..(mm@.......>.
        0x0010:  c0a8 3e8d c24d 0066 808a b5ba dbc1 4872  ..>..M.f......Hr
        0x0020:  5010 2012 7433 0000 0000 0000 0000       P...t3........
b'E\x00\x00(mm@\x00\x80\x06\x8f\x00\xc0\xa8>\x84\xc0\xa8>\x8d\xc2M\x00f\x80\x8a\xb5\xba\xdb\xc1HrP\x10 \x12t3\x00\x00\x00\x00\x00\x00\x00\x00'
00:58:06.399778 IP (tos 0x0, ttl 128, id 28014, offset 0, flags [DF], proto TCP (6), length 114)
    192.168.62.132.49741 > 192.168.62.141.102: Flags [P.], cksum 0x1bfc (correct), seq 2156574138:2156574212, ack 3686877298, win 8210, length 74
        0x0000:  4500 0072 6d6e 4000 8006 8eb5 c0a8 3e84  E..rmn@.......>.
        0x0010:  c0a8 3e8d c24d 0066 808a b5ba dbc1 4872  ..>..M.f......Hr
        0x0020:  5018 2012 1bfc 0000 0300 004a 02f0 8001  P..........J....
        0x0030:  0001 0061 3d30 3b02 0103 a036 a034 0201  ...a=0;....6.4..
        0x0040:  25a4 2f80 0101 a12a a028 3026 a024 a122  %./....*.(0&.$."
        0x0050:  1a12 7369 6d65 6e73 5349 4d45 4e53 5f52  ..simensSIMENS_R
        0x0060:  4337 5f41 1a0c 4747 494f 3124 4346 244d  C7_A..GGIO1$CF$M
        0x0070:  6f64                                     od
00:58:06.399795 IP (tos 0x0, ttl 64, id 21026, offset 0, flags [DF], proto TCP (6), length 40)
    192.168.62.141.102 > 192.168.62.132.49741: Flags [.], cksum 0xfe7c (incorrect -> 0x9206), seq 3686877298, ack 2156574212, win 501, length 0
        0x0000:  4500 0028 5222 4000 4006 ea4b c0a8 3e8d  E..(R"@.@..K..>.
        0x0010:  c0a8 3e84 0066 c24d dbc1 4872 808a b604  ..>..f.M..Hr....
        0x0020:  5010 01f5 fe7c 0000                      P....|..
00:58:06.399889 IP (tos 0x0, ttl 64, id 21027, offset 0, flags [DF], proto TCP (6), length 74)
    192.168.62.141.102 > 192.168.62.132.49741: Flags [P.], cksum 0xfe9e (incorrect -> 0x67a9), seq 3686877298:3686877332, ack 2156574212, win 501, length 34
        0x0000:  4500 004a 5223 4000 4006 ea28 c0a8 3e8d  E..JR#@.@..(..>.
        0x0010:  c0a8 3e84 0066 c24d dbc1 4872 808a b604  ..>..f.M..Hr....
        0x0020:  5018 01f5 fe9e 0000 0300 0022 02f0 8001  P.........."....
        0x0030:  0001 0061 1530 1302 0103 a00e a10c 0201  ...a.0..........
        0x0040:  25a4 07a1 05a2 0385 0100                 %.........
b'E\x00\x00rmn@\x00\x80\x06\x8e\xb5\xc0\xa8>\x84\xc0\xa8>\x8d\xc2M\x00f\x80\x8a\xb5\xba\xdb\xc1HrP\x18 \x12\x1b\xfc\x00\x00\x03\x00\x00J\x02\xf0\x80\x01\x00\x01\x00a=0;\x02\x01\x03\xa06\xa04\x02\x01%\xa4/\x80\x01\x01\xa1*\xa0(0&\xa0$\xa1"\x1a\x12simensSIMENS_RC7_A\x1a\x0cGGIO1$CF$Mod'
b'E\x00\x00(R"@\x00@\x06\xeaK\xc0\xa8>\x8d\xc0\xa8>\x84\x00f\xc2M\xdb\xc1Hr\x80\x8a\xb6\x04P\x10\x01\xf5\xfe|\x00\x00'
b'E\x00\x00JR#@\x00@\x06\xea(\xc0\xa8>\x8d\xc0\xa8>\x84\x00f\xc2M\xdb\xc1Hr\x80\x8a\xb6\x04P\x18\x01\xf5\xfe\x9e\x00\x00\x03\x00\x00"\x02\xf0\x80\x01\x00\x01\x00a\x150\x13\x02\x01\x03\xa0\x0e\xa1\x0c\x02\x01%\xa4\x07\xa1\x05\xa2\x03\x85\x01\x00'

This is with scapy 

[Info] Found the following (IP layer): 192.168.62.141 -> 192.168.62.13201:00:12.313181 IP (tos 0x0, ttl 64, id 21041, offset 0, flags [DF], proto TCP (6), length 74)
    192.168.62.141.102 > 192.168.62.132.49741: Flags [P.], cksum 0xfe9e (incorrect -> 0x663d), seq 3686877332:3686877366, ack 2156574286, win 501, length 34
        0x0000:  4500 004a 5231 4000 4006 ea1a c0a8 3e8d  E..JR1@.@.....>.
        0x0010:  c0a8 3e84 0066 c24d dbc1 4894 808a b64e  ..>..f.M..H....N
        0x0020:  5018 01f5 fe9e 0000 0300 0022 02f0 8001  P.........."....
        0x0030:  0001 0061 1530 1302 0103 a00e a10c 0201  ...a.0..........
        0x0040:  26a4 07a1 05a2 0385 0100                 &.........

b'\x03\x00\x00"\x02\xf0\x80\x01\x00\x01\x00a\x150\x13\x02\x01\x03\xa0\x0e\xa1\x0c\x02\x01&\xa4\x07\xa1\x05\xa2\x03\x85\x01\x00'
01:00:12.365554 IP (tos 0x0, ttl 128, id 28029, offset 0, flags [DF], proto TCP (6), length 40)
    192.168.62.132.49741 > 192.168.62.141.102: Flags [.], cksum 0x735b (correct), seq 2156574286, ack 3686877366, win 8210, length 0
        0x0000:  4500 0028 6d7d 4000 8006 8ef0 c0a8 3e84  E..(m}@.......>.
        0x0010:  c0a8 3e8d c24d 0066 808a b64e dbc1 48b6  ..>..M.f...N..H.
        0x0020:  5010 2012 735b 0000 0000 0000 0000       P...s[........

[Info] Found the following (IP layer): 192.168.62.132 -> 192.168.62.14101:00:22.318146 IP (tos 0x0, ttl 128, id 28030, offset 0, flags [DF], proto TCP (6), length 41)
    192.168.62.132.49741 > 192.168.62.141.102: Flags [.], cksum 0x735b (correct), seq 2156574285:2156574286, ack 3686877366, win 8210, length 1
        0x0000:  4500 0029 6d7e 4000 8006 8eee c0a8 3e84  E..)m~@.......>.
        0x0010:  c0a8 3e8d c24d 0066 808a b64d dbc1 48b6  ..>..M.f...M..H.
        0x0020:  5010 2012 735b 0000 0000 0000 0000       P...s[........
01:00:22.318169 IP (tos 0x0, ttl 64, id 21042, offset 0, flags [DF], proto TCP (6), length 52)
    192.168.62.141.102 > 192.168.62.132.49741: Flags [.], cksum 0xfe88 (incorrect -> 0xedaf), seq 3686877366, ack 2156574286, win 501, options [nop,nop,sack 1 {2156574285:2156574286}], length 0
        0x0000:  4500 0034 5232 4000 4006 ea2f c0a8 3e8d  E..4R2@.@../..>.
        0x0010:  c0a8 3e84 0066 c24d dbc1 48b6 808a b64e  ..>..f.M..H....N
        0x0020:  8010 01f5 fe88 0000 0101 050a 808a b64d  ...............M
        0x0030:  808a b64e                                ...N

b'\x00'

[Info] Found the following (IP layer): 192.168.62.132 -> 192.168.62.14101:00:26.307351 IP (tos 0x0, ttl 128, id 28031, offset 0, flags [DF], proto TCP (6), length 114)
    192.168.62.132.49741 > 192.168.62.141.102: Flags [P.], cksum 0x1924 (correct), seq 2156574286:2156574360, ack 3686877366, win 8210, length 74
        0x0000:  4500 0072 6d7f 4000 8006 8ea4 c0a8 3e84  E..rm.@.......>.
        0x0010:  c0a8 3e8d c24d 0066 808a b64e dbc1 48b6  ..>..M.f...N..H.
        0x0020:  5018 2012 1924 0000 0300 004a 02f0 8001  P....$.....J....
        0x0030:  0001 0061 3d30 3b02 0103 a036 a034 0201  ...a=0;....6.4..
        0x0040:  27a4 2f80 0101 a12a a028 3026 a024 a122  './....*.(0&.$."
        0x0050:  1a12 7369 6d65 6e73 5349 4d45 4e53 5f52  ..simensSIMENS_R
        0x0060:  4337 5f41 1a0c 4747 494f 3124 4346 244d  C7_A..GGIO1$CF$M
        0x0070:  6f64                                     od
01:00:26.307373 IP (tos 0x0, ttl 64, id 21043, offset 0, flags [DF], proto TCP (6), length 40)
    192.168.62.141.102 > 192.168.62.132.49741: Flags [.], cksum 0xfe7c (incorrect -> 0x912e), seq 3686877366, ack 2156574360, win 501, length 0
        0x0000:  4500 0028 5233 4000 4006 ea3a c0a8 3e8d  E..(R3@.@..:..>.
        0x0010:  c0a8 3e84 0066 c24d dbc1 48b6 808a b698  ..>..f.M..H.....
        0x0020:  5010 01f5 fe7c 0000                      P....|..

b'\x03\x00\x00J\x02\xf0\x80\x01\x00\x01\x00a=0;\x02\x01\x03\xa06\xa04\x02\x01\'\xa4/\x80\x01\x01\xa1*\xa0(0&\xa0$\xa1"\x1a\x12simensSIMENS_RC7_A\x1a\x0cGGIO1$CF$Mod'

[Info] Found the following (IP layer): 192.168.62.141 -> 192.168.62.13201:00:26.309110 IP (tos 0x0, ttl 64, id 21044, offset 0, flags [DF], proto TCP (6), length 74)
    192.168.62.141.102 > 192.168.62.132.49741: Flags [P.], cksum 0xfe9e (incorrect -> 0x64d1), seq 3686877366:3686877400, ack 2156574360, win 501, length 34
        0x0000:  4500 004a 5234 4000 4006 ea17 c0a8 3e8d  E..JR4@.@.....>.
        0x0010:  c0a8 3e84 0066 c24d dbc1 48b6 808a b698  ..>..f.M..H.....
        0x0020:  5018 01f5 fe9e 0000 0300 0022 02f0 8001  P.........."....
        0x0030:  0001 0061 1530 1302 0103 a00e a10c 0201  ...a.0..........
        0x0040:  27a4 07a1 05a2 0385 0100                 '.........

b'\x03\x00\x00"\x02\xf0\x80\x01\x00\x01\x00a\x150\x13\x02\x01\x03\xa0\x0e\xa1\x0c\x02\x01\'\xa4\x07\xa1\x05\xa2\x03\x85\x01\x00'
01:00:26.350122 IP (tos 0x0, ttl 128, id 28032, offset 0, flags [DF], proto TCP (6), length 40)
    192.168.62.132.49741 > 192.168.62.141.102: Flags [.], cksum 0x72ef (correct), seq 2156574360, ack 3686877400, win 8210, length 0
        0x0000:  4500 0028 6d80 4000 8006 8eed c0a8 3e84  E..(m.@.......>.
        0x0010:  c0a8 3e8d c24d 0066 808a b698 dbc1 48d8  ..>..M.f......H.
        0x0020:  5010 2012 72ef 0000 0000 0000 0000       P...r.........

**Comment by aouinizied** [comment]
@ArtWachowski Thanks for the feedback.

* 1: You may also use on_init() method to see the first packet of your connection. Note that nfstream show ip_packet content which is the packet content starting from the IP header level. We did such a choice as nfstream is intended for IP monitoring so we consider that most users will not care about L2 layer. In which use case you will need such data?

*2: for parsing part, you can use scapy or dpkt or any of your favorite library. 

*3: On ML side, indeed some additional examples would be nice. Which part is not clear so we will try to add some examples focusing on it?

BR
