### ISSUE TITLE
Can not read packet form linux named pipe

### ISSUE THREAD

**Issue by missyoyo** [nfstream/nfstream#28]
Hi:
    I am try to read packet form linux named pipe by follow:
1.make a named pipe by command:
mkfifo /tmp/01.pcap
2. Send packet by tcpdump to named pipe by command:
tcpdump -w /tmp/01.pcap
3.try to read packet from pipe by tcpdump test:
# tcpdump -r /tmp/01.pcap 
reading from file /tmp/01.pcap, link-type EN10MB (Ethernet)
00:00:23.123099 IP 72.21.81.189.https > localhost.localdomain.35346: Flags [P.], seq 3261175202:3261175301, ack 3821948898, win 64240, length 99
00:00:23.123161 IP localhost.localdomain.35346 > 72.21.81.189.https: Flags [.], ack 99, win 29200, length 0
00:00:23.133850 IP localhost.localdomain.35346 > 72.21.81.189.https: Flags [P.], seq 1:339, ack 99, win 29200, length 338

This work good when use tcpdump read packet from file(named pipe).

But this is not work when use nfstream:
ERROR MESSAGES:
Undefined source: /tmp/01.pcap. Please specify a pcap file path or a valid network interface name.

Normal file work fine but not named pipe. Would you like to add support for named pipe input?
Thank you.

**Comment by aouinizied** [comment]
@missyoyo as stated by the documentation, NFstream supports only interfaces or pcap file. namedpipe are not supported.
Fill free to implement it and open a Merge Request.

Regards,
Zied
